title,bibtex,year,wearability,presentation_mode,deployment_context,form_factor,target_body_area,stimulation_scope,stimulus_type,actuator_type,audio-tactile_mapping,purpose,audio_device,accessibility_focus,connectivity,application_domain
Audio-Tactile Rendering- A Review on Technology and Methods to Convey Musical Information through the Sense of Touch,remache2021audio,2021,NA,NA,NA,NA,NA,NA,NA,NA,NA,NA,NA,no,NA,review_paper
Musical haptics,papetti2018musical,2018,NA,NA,NA,NA,NA,NA,NA,NA,NA,NA,NA,no,NA,review_paper
Can Haptic Stimulation Enhance Music Perception in Hearing-Impaired Listeners?,fletcher2021can,2021,NA,NA,NA,NA,NA,NA,NA,NA,NA,NA,NA,DHH,NA,review_paper
Auditory-Tactile Narratives: Designing New Embodied Auditory-Tactile Mappings Using Body Maps,cavdir2024auditory,2024,both,recorded,NA,chair and fingers device,whole_body,multiple,vibration,combination (voice_coil and ERMs),ad-hoc_composition,music_enrichment,headphones,no,wireless,perceptual_study
Configuring a Haptic Interface for Music Performance,armitage2015configuring,2015,no,live,performance,chair,back,single,vibration,ERMs,ad-hoc_composition,music_enrichment,loudspeakers,no,wired,perceptual_study
Cutaneous grooves: composing for the sense of touch,gunther2003cutaneous,2010,yes,recorded,performance,suit,whole_body,multiple,vibration,voice_coil,ad-hoc_composition,music_enrichment,headphones,no,wired,real_world
Feeling Sound: Exploring a Haptic-Audio Relationship,armitage2015feeling,2015,no,recorded,installation,chair,back,single,vibration,ERMs,ad-hoc_composition,music_enrichment,headphones,no,wired,real_world
‘Unheard’ Sounds,armitage2015unheard,2015,no,recorded,installation,chair,back,single,vibration,ERMs,ad-hoc_composition,music_enrichment,loudspeakers,no,wired,real_world
An Adaptive Musical Vibrotactile System (MuViT) for Modern Smartphones,yan2022adaptive,2022,no,recorded,personal_use,smartphone,hand,single,vibration,LRAs,direct_translation,music_enrichment,either,no,standalone,real_world
Feeling the effort of classical musicians-a pipeline from electromyography to smartphone vibration for live music performance,verdugo2022feeling,2022,no,live,performance,smartphone,hand,single,vibration,LRAs,NA,performer_understanding,either,no,wireless,real_world
Feeling the music- exploring emotional effects of auditory- tactile musical experiences,schwartz2025feeling,2025,yes,recorded,NA,"glove, vest, band","palm,chest, ankle",multiple,vibration,voice_coil,direct_translation,music_enrichment,headphones,no,wired,perceptual_study
FeelMusic: Enriching our emotive experience of music through audio-tactile mappings,haynes2021feelmusic,2021,yes,recorded,personal_use,sleeve,"upper_arm, fore arm",multiple,"displacement, vibration",combination (ERMs and air pump),ad-hoc_composition,music_enrichment,headphones,no,wired,perceptual_study
Haptic Music Feedback through Audio Decomposition,shin2025haptic,2025,yes,recorded,personal_use,"gloves, vest","hand, chest, back",multiple,vibration,combination (ERMs and LRAs),direct_translation,music_enrichment,either,no,wired,real_world
Haptic music: exploring whole-body vibrations and tactile sound for a multisensory music installation,frid2020haptic,2020,no,interactive,installation,floor,vertical_whole_body,single,vibration,contact_speaker,direct_translation,music_enrichment,loudspeakers,no,wired,real_world
Haptic-Listening and the Classical Guitar,mcdowell2018haptic,2018,no,recorded,personal_use,cushion,"Sternum, chest",single,vibration,voice_coil,direct_translation,music_enrichment,headphones,no,wired,real_world
Haptification of performer's control gestures in live electronic music performance,turchet2019haptification,2019,yes,live,performance,armband,upper_arm ,single,vibration,ERMs,NA,performer_understanding,loudspeakers,no,wireless,real_world
Harmonious Touch: Haptic Wristband for Home Listening Experience,melder2024harmonious,2024,yes,recorded,personal_use,wristband,wrist,single,vibration,ERMs,direct_translation,music_enrichment,either,no,wired,real_world
Implementation of Tension-Based Compact Necklace-Type Haptic Device Achieving Widespread Transmission of Low-Frequency Vibrations,yamazaki2022implementation,2022,yes,recorded,personal_use,necklace,"chest, neck",multiple,vibration,voice_coil,direct_translation,music_enrichment,loudspeakers,no,standalone,real_world
Mapping Monophonic MIDI Tracks to Vibrotactile Stimuli Using Tactile Illusions,remache2022mapping,2022,no,recorded,personal_use,ad_hoc_form_factor,hands,single,vibration,voice_coil,ad-hoc_composition,music_enrichment,headphones,no,wired,real_world
CollarBeat: Whole Body Vibrotactile Presentation via the Collarbone to Enrich Music Listening Experience,sakuragi2015collarbeat,2015,yes,recorded,personal_use,ad_hoc_form_factor,"whole_body (collarbone, buttocks, head, and palms)",multiple,vibration,voice_coil,direct_translation,music_enrichment,headphones,no,wired,real_world
Composition Techniques for the Ilinx Vibrotactile Garment,hattwick2015composition,2015,yes,recorded,installation,suit,whole_body,multiple,vibration,ERMs,ad-hoc_composition,music_enrichment,loudspeakers,no,wireless,real_world
Demo of interactions between a performer playing a Smart Mandolin and audience members using Musical Haptic Wearables,turchet2018demo,2018,yes,live,performance,armband,upper_arm ,single,vibration,ERMs,ad-hoc_composition,music_enrichment,loudspeakers,no,wireless,real_world
Hapbeat: Single DOF Wide Range Wearable Haptic Display,yamazaki2017hapbeat,2017,yes,recorded,personal_use,belt,trunk,single,vibration,ERMs,ad-hoc_composition,music_enrichment,headphones,no,wireless,VR
Livejacket: Wearable music experience device with multiple speakers,hashizume2018livejacket,2018,yes,recorded,personal_use,jacket,upper_body,multiple,vibration,voice_coil,direct_translation,music_enrichment,either,no,wired,real_world
Mood Glove: A haptic wearable prototype system to enhance mood music in film,mazzoni2016moodglove,2016,yes,recorded,personal_use,glove,hand,single,vibration,ERMs,ad-hoc_composition,music_enrichment,loudspeakers,no,wired,cinema
Multimodal Music Composition,armitage2013multimodal,2013,NA,NA,NA,NA,NA,NA,NA,NA,NA,NA,NA,no,NA,theoretical_paper
Musical haptics for the listener: Reflections of a design practitioner,turchet2022musical,2022,NA,NA,NA,NA,NA,NA,NA,NA,NA,NA,NA,no,NA,theoretical_paper
Music Tactalizer: A Wearable Haptic Music Player with Multi-Feature Audio-Tactile Rendering,see2025music,2025,yes,recorded,personal_use,glove,hand,single,displacement,piezo,ad-hoc_composition,music_enrichment,either,no,wireless,real_world
Feeling connected: the role of haptic feedback in VR concerts and the impact of haptic music players on the music listening experience,venkatesan2023feeling,2023,yes,recorded,personal_use,wristband,wrist,single,vibration,voice_coil,direct_translation,music_enrichment,headphones,no,wireless,VR
Multisensory Music Listening in Affective Virtual Environments,turchet2025multisensory,2025,yes,recorded,personal_use,vest,"torso, back",multiple,vibration,voice_coil,direct_translation,music_enrichment,headphones,no,wired,VR
Musinger: Communication of Music over a Distance with Wearable Haptic Display and Touch Sensitive Surface,cabrera2024musinger,2024,yes,live,performance,robotic_interface,forearm,single,displacement,servo_motor,NA,performer_understanding,none,DHH,wireless,real_world
MUVIB: Music and Vibration,la2014muvib,2014,yes,recorded,personal_use,wristband,wrist,single,vibration,ERMs,direct_translation,sensory_substitution,headphones,DHH,wireless,real_world
Navigation Method Enhancing Music Listening Experience by Stimulating Both Neck Sides With Modulated Musical Vibration,yamazaki2023navigation,2023,yes,recorded,personal_use,necklace,"chest, neck",multiple,vibration,ERMs,ad-hoc_composition,music_enrichment,headphones,no,wireless,VR
PalmBeat: A Kinesthetic Way to Feel Groove With Music,sun2021palmbeat,2021,yes,live,personal_use,glove,hand,single,displacement,servo_motor,NA,performer_understanding,headphones,no,wired,VR
Evaluation of audio-tactile congruences for a wearable musical interface,aker2024evaluation,2024,yes,recorded,personal_use,vest,back,single,vibration,voice_coil,direct_translation,music_enrichment,headphones,no,wired,perceptual_study
Real-Time Dual-Band Haptic Music Player for Mobile Devices,hwang2013real,2013,no,recorded,personal_use,smartphone / handheld mockup,hand,single,vibration,DMA,direct_translation,music_enrichment,headphones,no,wired,real_world
Reducing preferred listening levels in headphones through coherent audiotactile stimulation,liapikou2024reducing,2024,yes,recorded,personal_use,headphones,head,single,vibration,voice_coil,direct_translation,music_enrichment,headphones,no,wired,perceptual_study
Perceived auditory dynamic range is enhanced with wrist-based tactile stimulation,aker2024perceived,2024,yes,recorded,personal_use,bracelet,wrist,single,vibration,voice_coil,direct_translation,music_enrichment,headphones,no,wired,perceptual_study
Skin Music (2012)- an Audio-Haptic Composition for Ears and Body,hayes2015skin,2015,no,recorded,installation,chair,whole_body,multiple,vibration,combination (voice_coil and ERMs and piezo),ad-hoc_composition,music_enrichment,loudspeakers,no,wired,real_world
Smart Mandolin and Musical Haptic Gilet: effects of vibro-tactile stimuli during live music performance,turchet2019smart,2019,yes,live,performance,vest,upper_body ,multiple,vibration,ERMs,ad-hoc_composition,music_enrichment,loudspeakers,no,wireless,real_world
Tactile composition: configurations and communications for a musical haptic chair,armitage2014tactile,2014,no,live,performance,chair,back,single,vibration,ERMs,ad-hoc_composition,music_enrichment,loudspeakers,no,wired,real_world
Tension-Based Wearable Vibroacoustic Device for Music Appreciation,yamazaki2016tension,2016,yes,recorded,personal_use,necklace,"chest, neck",multiple,vibration,ERMs,ad-hoc_composition,music_enrichment,headphones,no,wireless,VR
The Emoti-Chair: An Interactive Tactile Music Exhibit,karam2010emoti,2010,no,recorded,installation,chair,back,multiple,vibration,voice_coil,direct_translation,sensory_substitution,loudspeakers,DHH,wired,real_world
The hedonic haptic player,vallgaarda2017hedonic,2017,yes,recorded,personal_use,ad_hoc_form_factor,upper_body,multiple,vibration,ERMs,ad-hoc_composition,music_enrichment,none,no,standalone,real_world
The hedonic haptics player: a wearable device to experience vibrotactile compositions,boer2017hedonic,2017,yes,recorded,personal_use,ad_hoc_form_factor,upper_body,multiple,vibration,ERMs,ad-hoc_composition,music_enrichment,none,no,standalone,real_world
The Ilinx Garment: Whole-body tactile experience in a multisensorial art installation,lamontagne2015ilinx,2015,yes,live,installation,suit,whole_body,multiple,vibration,ERMs,ad-hoc_composition,music_enrichment,loudspeakers,no,wireless,real_world
TOuch ThE Music: Displaying Live Music into Vibration,pate2022touch,2022,no,live,performance,ad_hoc_form_factor,hands,multiple,vibration,voice_coil,ad-hoc_composition,sensory_substitution,loudspeakers,DHH,wireless,real_world
"Design and implementation of a whole-body haptic suit for “Ilinx”, a multisensory art installation",giordano2015design,2015,yes,live,installation,suit,whole_body,multiple,vibration,ERMs,ad-hoc_composition,music_enrichment,loudspeakers,no,wireless,real_world
Towards an aesthetics of touch,hayes2017towards,2017,NA,NA,NA,NA,NA,NA,NA,NA,NA,NA,NA,no,NA,theoretical_paper
Vibratory and acoustical factors in multimodal reproduction of concert DVDs,merchel2009vibratory,2009,no,recorded,installation,floor,vertical_whole_body,single,vibration,voice_coil,direct_translation,music_enrichment,loudspeakers,no,wired,real_world
Vibrotactile display of music on the human back,branje2010vibrotactile,2010,yes,recorded,personal_use,ad_hoc_form_factor,back,single,vibration,voice_coil,direct_translation,music_enrichment,none,no,wired,perceptual_study
Vibrotactile enhancement of musical engagement,siedenburg2024vibrotactile,2024,no,recorded,personal_use,chair,whole_body,multiple,vibration,contact_speaker,direct_translation,music_enrichment,headphones,no,wired,perceptual_study
Undetectable very-low frequency sound increases dancing at a live concert,cameron2022undetectable,2022,no,live,performance,NA,whole_body,NA,vibration,subwoofer,NA,NA,loudspeakers,no,NA,perceptual_study
Wearable Haptic Music Player with Multi-Feature Extraction Using Spectral Flux and Yin Algorithms,alcuitas2025wearable,2025,yes,recorded,personal_use,glove,hand,single,displacement,piezo,ad-hoc_composition,music_enrichment,either,no,wireless,real_world
An artistic audiotactile installation for augmented music,marozeau2023artistic,2023,no,recorded,installation,chair and ad_hoc_formats,whole_body,multiple,vibration,voice_coil,ad-hoc_composition,music_enrichment,none,no,standalone,real_world
Effect Of Audio-Tactile Congruence on Vibrotactile Music Enhancement,aker2022effect,2022,no,recorded,personal_use,ad_hoc_form_factor,fingertip,single,vibration,voice_coil,direct_translation,music_enrichment,headphones,no,wired,perceptual_study
Electro-tactile stimulation enhances cochlear-implant melody recognition: effects of rhythm and musical training,huang2020electro,2020,no,recorded,personal_use,ad_hoc_form_factor,fingertip,single,vibration,voice_coil,direct_translation,sensory_substitution,loudspeakers,DHH,wired,real_world
Tactile displays for auditory augmentation–A scoping review and reflections on music applications for hearing impaired users,paisa2023tactile,2023,NA,NA,NA,NA,NA,NA,NA,NA,NA,NA,NA,DHH,NA,review_paper
Exposure to vibrotactile music improves audiometric performances in individuals with cochlear implants,turchet2025exposure,2025,yes,recorded,personal_use,vest,upper_body,multiple,vibration,voice_coil,direct_translation,therapeutic,headphones,DHH,wired,clinical
Enhancing Pitch Perception and Melodic Reproduction of Hard-of-Hearing Individuals Using a Vibrotactile Glove,shin2025enhancing,2025,yes,recorded,personal_use,glove,hand,single,vibration,ERMs,ad-hoc_composition,sensory_substitution,headphones,DHH,wireless,perceptual_study
Enhanced pitch discrimination for cochlear implant users with a new haptic neuroprosthetic,fletcher2020enhanced,2020,yes,recorded,personal_use,sleeve,forearm,single,vibration,ERMs,ad-hoc_composition,sensory_substitution,headphones,DHH,wired,perceptual_study
The deaf musical experience: Bodily and visual specificities: Corpaurality and vusicality,breteche2019deaf,2019,NA,NA,NA,NA,NA,NA,NA,NA,NA,NA,NA,DHH,NA,theoretical_paper
A multi-channel vibrotactile speaker system for a more equally shared musical experience between the deaf and the hearing individuals,briceno2024multi,2024,no,recorded,personal_use,ad_hoc_form_factor,hand,single,vibration,voice_coil,direct_translation,sensory_substitution,none,DHH,wired,real_world
Auris system: Providing vibrotactile feedback for hearing impaired population.,alves2017auris,2017,both,recorded,personal_use,"chair, armband","whole_body, arms",multiple,vibration,"combination (speakers, subwoofer and ERMS)",both,sensory_substitution,none,DHH,wired,real_world
Perception and learning of relative pitch by musicians using the vibrotactile mode,hopkins2023perception,2023,no,recorded,personal_use,ad_hoc_form_factor,"fingertip, forefoot",multiple,vibration,contact_speaker,direct_translation,sensory_substitution,none,DHH,wired,perceptual_study
Vibrotactile stimulation based on the fundamental frequency can improve melodic contour identification of normal-hearing listeners with a 4-channel cochlear implant simulation,luo2019vibrotactile,2019,yes,recorded,personal_use,bracelet,wrist,single,vibration,ERMs,direct_translation,sensory_substitution,headphones,DHH,wireless,perceptual_study
Rhythm processing in cochlear implant− mediated music perception,jiam2019rhythm,2019,NA,NA,NA,NA,NA,NA,NA,NA,NA,NA,NA,DHH,NA,review_paper
Haptic vibrations for hearing impaired to experience aspects of live music,deguglielmo2021haptic,2021,yes,live,performance,headband,head,multiple,vibration,LRAs,direct_translation,sensory_substitution,loudspeakers,DHH,standalone,real_world
Vibgrip++: haptic device allows feeling the music for hearing impaired people.,kanebako2016vibgrip++,2016,no,interactive,personal_use,ad_hoc_form_factor,fingertip,single,vibration,piezo,direct_translation,sensory_substitution,headphones,DHH,wired,real_world
The influence of rhythm on detection of auditory and vibrotactile asynchrony,lauzon2020influence,2020,no,recorded,installation,chair,back,single,vibration,voice_coil,direct_translation,music_enrichment,headphones,no,wired,perceptual_study
Judged consonance of tactile and auditory frequencies,okazaki2013judged,2013,no,recorded,personal_use,ad_hoc_form_factor,,single,vibration,voice_coil,direct_translation,music_enrichment,headphones,no,wired,perceptual_study
Vibrotactile stimulation can aﬀect auditory loudness: a pilot study,okazaki2012vibrotactile,2012,no,recorded,personal_use,box,hands,single,vibration,voice_coil,direct_translation,music_enrichment,headphones,no,wired,perceptual_study
Tactile tone system: a wearable device to assist accuracy of vocal pitch in cochlear implant user,shin2020tactile,2020,yes,live,personal_use,glove,hand,single,vibration,ERMs,ad-hoc_composition,sensory_substitution,loudspeakers,DHH,standalone,real_world
Exploring melodic variance in rhythmic haptic stimulus design,swerdfeger2009exploring,2009,no,recorded,personal_use,tablet,hand,single,vibration,piezo,ad-hoc_composition,music_enrichment,loudspeakers,no,standalone,perceptual_study
Haptics in music: the eﬀects of vibrotactile stimulus in low frequency auditory diﬀerence detection tasks.,young2016haptics,2016,yes,recorded,personal_use,glove,hand,single,vibration,voice_coil,direct_translation,music_enrichment,headphones,no,wired,perceptual_study
Touching the audience: musical haptic wearables for augmented and participatory live music performances,turchet2021touching,2021,yes,live,performance,vest,upper_body,multiple,vibration,ERMs,ad-hoc_composition,music_enrichment,loudspeakers,no,wireless,real_world
"Real-Time Musical Haptics With Ultra-Wideband: A Study on Latency, Reliability, and Perception",turchet2025real,2025,yes,live,performance,vest,upper_body,multiple,vibration,voice_coil,direct_translation,music_enrichment,loudspeakers,no,wireless,real_world
Interactive IoMusT-Based Concerts: Real-Time Pattern Recognition and Audience Experience,silva2025interactive,2025,yes,live,performance,vest,upper_body,multiple,vibration,voice_coil,ad-hoc_composition,music_enrichment,loudspeakers,no,wireless,MR
Hearing loss prevention at loud music events via real-time visuo-haptic feedback,turchet2024hearing,2024,yes,live,performance,bracelet,wrist,single,vibration,ERMs,NA,other,loudspeakers,no,wireless,real_world
Psychophysical comparison of the auditory and tactile perception: A survey,merchel2020psychophysical,2020,NA,NA,NA,NA,NA,NA,NA,NA,NA,NA,NA,no,NA,review_paper
Rhythm perception is shared between audio and haptics,bernard2022rhythm,2022,no,recorded,personal_use,ad_hoc_form_factor,fingertip,single,vibration,ultrasounds,ad-hoc_composition,music_enrichment,none,no,wired,perceptual_study
Evidence of beat perception via purely tactile stimulation,brochard2008evidence,2008,no,recorded,personal_use,ad_hoc_form_factor,hand,single,vibration,NA,NA,NA,none,no,wired,perceptual_study
Tactile enhancement of auditory detection and perceived loudness,gillmeister2007tactile,2007,no,recorded,personal_use,ad_hoc_form_factor,fingertip,single,vibration,solenoid,direct_translation,music_enrichment,loudspeakers,no,wired,perceptual_study
Feeling music: Integration of auditory and tactile inputs in musical meter perception,huang2012feeling,2012,no,recorded,personal_use,ad_hoc_form_factor,fingertip,single,vibration,voice_coil,direct_translation,music_enrichment,headphones,no,wired,perceptual_study
Designing the model human cochlea: An ambient crossmodal audio-tactile display,karam2009designing,2009,no,recorded,installation,chair,back,multiple,vibration,voice_coil,direct_translation,sensory_substitution,none,DHH,wired,real_world
Hands help hearing: Facilitatory audiotactile interaction at low sound-intensity levels,schurmann2004hands,2004,no,recorded,personal_use,tube,hand,single,vibration,voice_coil,direct_translation,music_enrichment,headphones,no,wired,perceptual_study
Improved tactile frequency discrimination in musicians,sharp2019improved,2019,yes,recorded,personal_use,glove,hand,single,vibration,voice_coil,direct_translation,music_enrichment,headphones,no,wired,perceptual_study
The effect of whole-body vibration on preferred bass equalization in automotive audio systems,simon2009effect,2009,no,recorded,personal_use,chair,whole_body,multiple,vibration,contact_speaker,direct_translation,music_enrichment,headphones,no,wired,perceptual_study
Whole-Body Vibration Associated with Low-Frequency Audio Reproduction Influences Preferred Bass Equalization,martens2009whole,2009,no,recorded,personal_use,chair,whole_body,multiple,vibration,contact_speaker,direct_translation,music_enrichment,headphones,no,wired,perceptual_study
Integration of auditory and vibrotactile stimuli: Effects of phase and stimulus-onset asynchrony,wilson2009integration,2009,no,recorded,personal_use,ad_hoc_form_factor,fingertip,single,vibration,voice_coil,direct_translation,music_enrichment,headphones,no,wired,perceptual_study
Integration of auditory and vibrotactile stimuli: Effects of frequency,wilson2010integration,2010,no,recorded,personal_use,ad_hoc_form_factor,fingertip,single,vibration,voice_coil,direct_translation,music_enrichment,headphones,no,wired,perceptual_study
Separate mechanisms for audio-tactile pitch and loudness interactions,yau2010separate,2010,no,recorded,personal_use,ad_hoc_form_factor,fingertip,single,vibration,contact_speaker,direct_translation,music_enrichment,headphones,no,wired,perceptual_study
"Vibrotactile Presentation of Musical Notes to the Glabrous Skin for Adults with Normal Hearing or a Hearing Impairment: Thresholds, Dynamic Range and High- Frequency Perception",hopkins2016vibrotactile,2016,no,recorded,personal_use,ad_hoc_form_factor,"fingertip, forefoot, heel",multiple,vibration,contact_speaker,direct_translation,sensory_substitution,none,DHH,wired,perceptual_study
Auditory and Tactile Perception of Musical Intervals: A Pilot Study,deiana2025auditory,2025,no,recorded,personal_use,ad_hoc_form_factor,fingertip,multiple,vibration,contact_speaker,direct_translation,music_enrichment,headphones,no,wired,perceptual_study
Feeling the beat: Bouncing synchronization to vibrotactile music in hearing and early deaf people,tranchant2017feeling,2017,no,recorded,performance,floor,vertical_whole_body,single,vibration,contact_speaker,direct_translation,sensory_substitution,none,DHH,wired,perceptual_study
Synchronizing to auditory and tactile metronomes: a test of the auditory-motor enhancement hypothesis.,ammirante2016synchronizing,2016,no,recorded,personal_use,chair,back,multiple,vibration,voice_coil,direct_translation,music_enrichment,none,no,wired,perceptual_study
Consonance of vibrotactile chords,yoo2013consonance,2013,no,recorded,personal_use,ad_hoc_form_factor,hand,single,vibration,contact_speaker,direct_translation,music_enrichment,none,no,wired,perceptual_study
An exploration on whole-body and foot-based vibrotactile sensi- tivity to melodic consonance,fontana2016exploration,2016,no,recorded,personal_use,chair and footrest,whole_body,multiple,vibration,contact_speaker,direct_translation,music_enrichment,headphones,no,wired,perceptual_study
Development and validation of a sensory-substitution technology for music,branje2009development,2009,no,recorded,personal_use,chair,back,multiple,vibration,voice_coil,direct_translation,sensory_substitution,loudspeakers,DHH,wired,real_world
Wearable musical haptic sleeves for people with hearing impairment,trivedi2019wearable,2019,yes,recorded,personal_use,sleeve,legs,multiple,vibration,voice_coil,direct_translation,sensory_substitution,loudspeakers,DHH,wired,real_world
A Way for Deaf and Hard of Hearing People to Enjoy Music by Exploring and Customizing Cross-modal Music Concepts,choi2024way,2024,yes,recorded,personal_use,armband,forearm,multiple,vibration,ERMs,direct_translation,sensory_substitution,none,DHH,wired,real_world
An enhanced musical experience for the deaf: design and evaluation of a music display and a haptic chair,nanayakkara2009enhanced,2009,no,recorded,personal_use,chair,whole_body,multiple,vibration,contact_speaker,direct_translation,sensory_substitution,none,DHH,wired,real_world
Composing vibrotactile music: A multi-sensory experience with the emoti-chair,baijal2012composing,2012,no,recorded,installation,chair,back,multiple,vibration,voice_coil,direct_translation,sensory_substitution,loudspeakers,DHH,wired,real_world
The importance of the haptic feedback in musical practice-Can a pianist distinguish a Steinway through listening?,altinsoy2016importance,2016,NA,NA,NA,NA,NA,NA,NA,NA,NA,NA,NA,no,NA,theoretical_paper
Vibrotactile Perception of Consonant and Dissonant Musical Intervals,garcia2025vibrotactile,2025,no,recorded,personal_use,box,fingertip,single,vibration,contact_speaker,direct_translation,music_enrichment,none,no,wired,perceptual_study
Vibrotactile teddy bear: enhancing musical experiences for children with cochlear nerve deficiency through a vibrotactile soft toy,ganis2025vibrotactile,2025,no,recorded,personal_use,ad_hoc_form_factor,hand,single,vibration,voice_coil,direct_translation,sensory_substitution,loudspeakers,DHH,standalone,real_world
Enhancing musical experience for the hearing-impaired using visual and haptic displays,nanayakkara2013enhancing,2013,no,recorded,personal_use,chair,whole_body,multiple,vibration,contact_speaker,direct_translation,sensory_substitution,none,DHH,wired,real_world
